{
  "$schema": "http://json-schema.org/draft-07/schema#",
  "$id": "https://shimotsukicodex.com/schemas/canon_fact.json",
  "title": "Canon fact",
  "description": "A row in canon_facts.json. Written by verify.py. Read by prove.py and bake.py. The shape codifies the contract between the verifier and downstream consumers.",
  "type": "object",
  "required": ["id", "subject", "predicate", "value", "tier", "sources"],
  "properties": {
    "id": {
      "description": "Stable claim identifier. Producers use known prefixes: 'verified:' (verify.py), 'first_app:' / 'total_app:' / 'flashback_count:' / 'cover_count:' / 'silhouette_count:' (extract_manga_facts.py), 'manual:' (hand-curated).",
      "type": "string",
      "pattern": "^[a-z_]+:.+$"
    },
    "subject":   {"type": "string", "minLength": 1},
    "predicate": {"type": "string", "minLength": 1},
    "value": {
      "description": "Scalar OR a structured value object (e.g. {chapter: N, type: 'full'} for first_app facts).",
      "type": ["string", "number", "boolean", "null", "object", "array"]
    },
    "tier":      {"$ref": "_common.json#/$defs/tier"},
    "intent":    {"$ref": "_common.json#/$defs/intent"},
    "sources": {
      "type": "array",
      "minItems": 1,
      "items": {"$ref": "_common.json#/$defs/source_citation"}
    },
    "evidence_notes": {"type": "string"},
    "verified_on":    {"$ref": "_common.json#/$defs/iso_date"},
    "verified_by":    {"type": "string"},
    "reveal_chapter": {
      "description": "The manga chapter at which this fact became publicly known to readers. Used by the Spoiler Shield (spoiler.js): consumers filter facts where reveal_chapter > user's effective cutoff. Auto-populated by extract_reveal_chapter.py; manual overrides in docs/reveal_overrides.json. NULL or missing = fail-closed (item hidden by gates).",
      "type": ["integer", "null"],
      "minimum": 0
    }
  },
  "additionalProperties": true
}
