[{"id":"first_app:Gambo","subject":"Gambo","predicate":"first_appearance","value":{"chapter":905,"type":"full"},"tier":"canon","sources":[{"type":"manga","chapter":905,"appearance_type":"full"}],"evidence_notes":"Derived from appearances.csv — Gambo first appears in Chapter 905 (full)","verified_on":"2026-04-26","verified_by":"extract_manga_facts.py v1"},{"id":"total_app:Gambo","subject":"Gambo","predicate":"total_appearance_count","value":8,"tier":"canon","sources":[{"type":"manga","chapters":[905,1058,1082,1083,1099,1109,1115,1125],"summary":"8 distinct chapters"}],"evidence_notes":"Gambo appears in 8 distinct chapters across the manga","verified_on":"2026-04-26","verified_by":"extract_manga_facts.py v1"}]