[{"id":"first_app:Marlon","subject":"Marlon","predicate":"first_appearance","value":{"chapter":1155,"type":"full"},"tier":"canon","sources":[{"type":"manga","chapter":1155,"appearance_type":"full"}],"evidence_notes":"Derived from appearances.csv — Marlon first appears in Chapter 1155 (full)","verified_on":"2026-04-26","verified_by":"extract_manga_facts.py v1"},{"id":"total_app:Marlon","subject":"Marlon","predicate":"total_appearance_count","value":5,"tier":"canon","sources":[{"type":"manga","chapters":[1155,1156,1157,1159,1169],"summary":"5 distinct chapters"}],"evidence_notes":"Marlon appears in 5 distinct chapters across the manga","verified_on":"2026-04-26","verified_by":"extract_manga_facts.py v1"},{"id":"cover_count:Marlon","subject":"Marlon","predicate":"cover_appearance_count","value":1,"tier":"canon","sources":[{"type":"manga","chapters":[1169],"appearance_type":"cover"}],"evidence_notes":"Marlon appears on chapter covers 1 time(s)","verified_on":"2026-04-26","verified_by":"extract_manga_facts.py v1"}]