[{"id":"first_app:Porchemy","subject":"Porchemy","predicate":"first_appearance","value":{"chapter":583,"type":"full"},"tier":"canon","sources":[{"type":"manga","chapter":583,"appearance_type":"full"}],"evidence_notes":"Derived from appearances.csv — Porchemy first appears in Chapter 583 (full)","verified_on":"2026-04-26","verified_by":"extract_manga_facts.py v1"},{"id":"total_app:Porchemy","subject":"Porchemy","predicate":"total_appearance_count","value":2,"tier":"canon","sources":[{"type":"manga","chapters":[583,584],"summary":"2 distinct chapters"}],"evidence_notes":"Porchemy appears in 2 distinct chapters across the manga","verified_on":"2026-04-26","verified_by":"extract_manga_facts.py v1"}]