[{"id":"first_app:Enishida","subject":"Enishida","predicate":"first_appearance","value":{"chapter":517,"type":"full"},"tier":"canon","sources":[{"type":"manga","chapter":517,"appearance_type":"full"}],"evidence_notes":"Derived from appearances.csv — Enishida first appears in Chapter 517 (full)","verified_on":"2026-04-26","verified_by":"extract_manga_facts.py v1"},{"id":"total_app:Enishida","subject":"Enishida","predicate":"total_appearance_count","value":3,"tier":"canon","sources":[{"type":"manga","chapters":[517,522,582],"summary":"3 distinct chapters"}],"evidence_notes":"Enishida appears in 3 distinct chapters across the manga","verified_on":"2026-04-26","verified_by":"extract_manga_facts.py v1"}]