[{"id":"first_app:Chouchou","subject":"Chouchou","predicate":"first_appearance","value":{"chapter":12,"type":"full"},"tier":"canon","sources":[{"type":"manga","chapter":12,"appearance_type":"full"}],"evidence_notes":"Derived from appearances.csv — Chouchou first appears in Chapter 12 (full)","verified_on":"2026-04-26","verified_by":"extract_manga_facts.py v1"},{"id":"total_app:Chouchou","subject":"Chouchou","predicate":"total_appearance_count","value":7,"tier":"canon","sources":[{"type":"manga","chapters":[12,13,14,21,36,619,1114],"summary":"7 distinct chapters"}],"evidence_notes":"Chouchou appears in 7 distinct chapters across the manga","verified_on":"2026-04-26","verified_by":"extract_manga_facts.py v1"},{"id":"cover_count:Chouchou","subject":"Chouchou","predicate":"cover_appearance_count","value":2,"tier":"canon","sources":[{"type":"manga","chapters":[36,619],"appearance_type":"cover"}],"evidence_notes":"Chouchou appears on chapter covers 2 time(s)","verified_on":"2026-04-26","verified_by":"extract_manga_facts.py v1"},{"id":"verified:Chouchou:birthday","subject":"Chouchou","predicate":"birthday","value":"November 22nd","tier":"likely","intent":"ambiguous","sources":[{"type":"sbs","volume":87,"qa_id":"1178","match_type":"digit-proximity","matched_form":"digit-group"},{"type":"wiki","page":"Chouchou","field":"birthday"}],"evidence_notes":"LIKELY (ambiguous) — matched via 'digit-proximity' in SBS Vol 87 #1178. Snippet: \"ikiokami **Rika: June 18; Onigiri Day **Boodle: January 16 **Chouchou: November 22 **Sham: April 19; 4 means \"Shamu\", and S is the 19th letter of the English al…\"","verified_on":"2026-04-26","verified_by":"verify.py v3 (intent-aware)"}]