[{"id":"first_app:Daidalos","subject":"Daidalos","predicate":"first_appearance","value":{"chapter":630,"type":"full"},"tier":"canon","sources":[{"type":"manga","chapter":630,"appearance_type":"full"}],"evidence_notes":"Derived from appearances.csv — Daidalos first appears in Chapter 630 (full)","verified_on":"2026-04-26","verified_by":"extract_manga_facts.py v1"},{"id":"total_app:Daidalos","subject":"Daidalos","predicate":"total_appearance_count","value":2,"tier":"canon","sources":[{"type":"manga","chapters":[630,644],"summary":"2 distinct chapters"}],"evidence_notes":"Daidalos appears in 2 distinct chapters across the manga","verified_on":"2026-04-26","verified_by":"extract_manga_facts.py v1"},{"id":"flashback_count:Daidalos","subject":"Daidalos","predicate":"flashback_count","value":1,"tier":"canon","sources":[{"type":"manga","chapters":[644],"appearance_type":"flashback"}],"evidence_notes":"Daidalos appears in flashback in 1 chapter(s)","verified_on":"2026-04-26","verified_by":"extract_manga_facts.py v1"}]