[{"id":"first_app:Zucca","subject":"Zucca","predicate":"first_appearance","value":{"chapter":564,"type":"full"},"tier":"canon","sources":[{"type":"manga","chapter":564,"appearance_type":"full"}],"evidence_notes":"Derived from appearances.csv — Zucca first appears in Chapter 564 (full)","verified_on":"2026-04-26","verified_by":"extract_manga_facts.py v1"},{"id":"total_app:Zucca","subject":"Zucca","predicate":"total_appearance_count","value":2,"tier":"canon","sources":[{"type":"manga","chapters":[564,574],"summary":"2 distinct chapters"}],"evidence_notes":"Zucca appears in 2 distinct chapters across the manga","verified_on":"2026-04-26","verified_by":"extract_manga_facts.py v1"}]