[{"id":"first_app:Choi","subject":"Choi","predicate":"first_appearance","value":{"chapter":555,"type":"full"},"tier":"canon","sources":[{"type":"manga","chapter":555,"appearance_type":"full"}],"evidence_notes":"Derived from appearances.csv — Choi first appears in Chapter 555 (full)","verified_on":"2026-04-26","verified_by":"extract_manga_facts.py v1"},{"id":"total_app:Choi","subject":"Choi","predicate":"total_appearance_count","value":3,"tier":"canon","sources":[{"type":"manga","chapters":[555,570,574],"summary":"3 distinct chapters"}],"evidence_notes":"Choi appears in 3 distinct chapters across the manga","verified_on":"2026-04-26","verified_by":"extract_manga_facts.py v1"}]