[{"id":"first_app:Koala","subject":"Koala","predicate":"first_appearance","value":{"chapter":622,"type":"full"},"tier":"canon","sources":[{"type":"manga","chapter":622,"appearance_type":"full"}],"evidence_notes":"Derived from appearances.csv — Koala first appears in Chapter 622 (full)","verified_on":"2026-04-26","verified_by":"extract_manga_facts.py v1"},{"id":"total_app:Koala","subject":"Koala","predicate":"total_appearance_count","value":35,"tier":"canon","sources":[{"type":"manga","chapters":[622,623,731,735,743,744,745,746,747,760,768,779,785,786,792,794,803,818,904,905,922,956,1021,1058,1060,1067,1082,1083,1084,1100,1109,1115,1125,1167,1175],"summary":"35 distinct chapters"}],"evidence_notes":"Koala appears in 35 distinct chapters across the manga","verified_on":"2026-04-26","verified_by":"extract_manga_facts.py v1"},{"id":"flashback_count:Koala","subject":"Koala","predicate":"flashback_count","value":1,"tier":"canon","sources":[{"type":"manga","chapters":[1021],"appearance_type":"flashback"}],"evidence_notes":"Koala appears in flashback in 1 chapter(s)","verified_on":"2026-04-26","verified_by":"extract_manga_facts.py v1"},{"id":"cover_count:Koala","subject":"Koala","predicate":"cover_appearance_count","value":4,"tier":"canon","sources":[{"type":"manga","chapters":[818,922,1084,1175],"appearance_type":"cover"}],"evidence_notes":"Koala appears on chapter covers 4 time(s)","verified_on":"2026-04-26","verified_by":"extract_manga_facts.py v1"},{"id":"verified:Koala:age","subject":"Koala","predicate":"age","value":"11 (Flashback, debut) · 23 (present)","tier":"likely","intent":"serious","sources":[{"type":"sbs","volume":77,"qa_id":"1012","match_type":"normalised","matched_form":"23"},{"type":"wiki","page":"Koala","field":"age"}],"evidence_notes":"LIKELY (serious) — matched via 'normalised' in SBS Vol 77 #1012. Snippet: \"d that's gotta be his birthday, for sure. [187&nbsp;cm age 22 · 160&nbsp;cm age 23 · 280&nbsp;cm age 38 (Brocade Perch Fish-Man)] [Sabo · Koala · Hack]…\"","verified_on":"2026-04-26","verified_by":"verify.py v3 (intent-aware)"},{"id":"verified:Koala:height","subject":"Koala","predicate":"height","value":"160 cm (5'3\")","tier":"likely","intent":"ambiguous","sources":[{"type":"sbs","volume":77,"qa_id":"1012","match_type":"digit-proximity","matched_form":"digit-group"},{"type":"wiki","page":"Koala","field":"height"}],"evidence_notes":"LIKELY (ambiguous) — matched via 'digit-proximity' in SBS Vol 77 #1012. Snippet: \"(KKu)? ║ Yes. And that's gotta be his birthday, for sure. [187&nbsp;cm age 22 · 160&nbsp;cm age 23 · 280&nbsp;cm age 38 (Brocade Perch Fish-Man)] [Sabo · Koala …\"","verified_on":"2026-04-26","verified_by":"verify.py v3 (intent-aware)"}]