[{"id":"first_app:Hippan_Natte","subject":"Hippan Natte","predicate":"first_appearance","value":{"chapter":948,"type":"full"},"tier":"canon","sources":[{"type":"manga","chapter":948,"appearance_type":"full"}],"evidence_notes":"Derived from appearances.csv — Hippan Natte first appears in Chapter 948 (full)","verified_on":"2026-04-26","verified_by":"extract_manga_facts.py v1"},{"id":"total_app:Hippan_Natte","subject":"Hippan Natte","predicate":"total_appearance_count","value":1,"tier":"canon","sources":[{"type":"manga","chapters":[948],"summary":"1 distinct chapters"}],"evidence_notes":"Hippan Natte appears in 1 distinct chapters across the manga","verified_on":"2026-04-26","verified_by":"extract_manga_facts.py v1"}]