[{"id":"first_app:Concelot","subject":"Concelot","predicate":"first_appearance","value":{"chapter":809,"type":"full"},"tier":"canon","sources":[{"type":"manga","chapter":809,"appearance_type":"full"}],"evidence_notes":"Derived from appearances.csv — Concelot first appears in Chapter 809 (full)","verified_on":"2026-04-26","verified_by":"extract_manga_facts.py v1"},{"id":"total_app:Concelot","subject":"Concelot","predicate":"total_appearance_count","value":18,"tier":"canon","sources":[{"type":"manga","chapters":[809,810,816,817,820,821,822,878,900,924,959,975,981,988,990,1000,1056,1115],"summary":"18 distinct chapters"}],"evidence_notes":"Concelot appears in 18 distinct chapters across the manga","verified_on":"2026-04-26","verified_by":"extract_manga_facts.py v1"},{"id":"flashback_count:Concelot","subject":"Concelot","predicate":"flashback_count","value":2,"tier":"canon","sources":[{"type":"manga","chapters":[878,959],"appearance_type":"flashback"}],"evidence_notes":"Concelot appears in flashback in 2 chapter(s)","verified_on":"2026-04-26","verified_by":"extract_manga_facts.py v1"},{"id":"cover_count:Concelot","subject":"Concelot","predicate":"cover_appearance_count","value":1,"tier":"canon","sources":[{"type":"manga","chapters":[900],"appearance_type":"cover"}],"evidence_notes":"Concelot appears on chapter covers 1 time(s)","verified_on":"2026-04-26","verified_by":"extract_manga_facts.py v1"}]