[{"id":"first_app:Speed","subject":"Speed","predicate":"first_appearance","value":{"chapter":917,"type":"full"},"tier":"canon","sources":[{"type":"manga","chapter":917,"appearance_type":"full"}],"evidence_notes":"Derived from appearances.csv — Speed first appears in Chapter 917 (full)","verified_on":"2026-04-26","verified_by":"extract_manga_facts.py v1"},{"id":"total_app:Speed","subject":"Speed","predicate":"total_appearance_count","value":21,"tier":"canon","sources":[{"type":"manga","chapters":[917,918,919,923,1004,1016,1017,1018,1024,1026,1030,1041,1043,1051,1052,1053,1131,1132,1133,1136,1148],"summary":"21 distinct chapters"}],"evidence_notes":"Speed appears in 21 distinct chapters across the manga","verified_on":"2026-04-26","verified_by":"extract_manga_facts.py v1"},{"id":"cover_count:Speed","subject":"Speed","predicate":"cover_appearance_count","value":5,"tier":"canon","sources":[{"type":"manga","chapters":[1131,1132,1133,1136,1148],"appearance_type":"cover"}],"evidence_notes":"Speed appears on chapter covers 5 time(s)","verified_on":"2026-04-26","verified_by":"extract_manga_facts.py v1"}]