[{"id":"first_app:Alpha","subject":"Alpha","predicate":"first_appearance","value":{"chapter":1100,"type":"full"},"tier":"canon","sources":[{"type":"manga","chapter":1100,"appearance_type":"full"}],"evidence_notes":"Derived from appearances.csv — Alpha first appears in Chapter 1100 (full)","verified_on":"2026-04-26","verified_by":"extract_manga_facts.py v1"},{"id":"total_app:Alpha","subject":"Alpha","predicate":"total_appearance_count","value":2,"tier":"canon","sources":[{"type":"manga","chapters":[1100,1101],"summary":"2 distinct chapters"}],"evidence_notes":"Alpha appears in 2 distinct chapters across the manga","verified_on":"2026-04-26","verified_by":"extract_manga_facts.py v1"}]