[{"id":"first_app:John","subject":"John","predicate":"first_appearance","value":{"chapter":450,"type":"full"},"tier":"canon","sources":[{"type":"manga","chapter":450,"appearance_type":"full"}],"evidence_notes":"Derived from appearances.csv — John first appears in Chapter 450 (full)","verified_on":"2026-04-26","verified_by":"extract_manga_facts.py v1"},{"id":"total_app:John","subject":"John","predicate":"total_appearance_count","value":16,"tier":"canon","sources":[{"type":"manga","chapters":[450,451,452,453,456,460,481,1096,1156,1157,1159,1160,1161,1163,1164,1169],"summary":"16 distinct chapters"}],"evidence_notes":"John appears in 16 distinct chapters across the manga","verified_on":"2026-04-26","verified_by":"extract_manga_facts.py v1"},{"id":"cover_count:John","subject":"John","predicate":"cover_appearance_count","value":1,"tier":"canon","sources":[{"type":"manga","chapters":[1169],"appearance_type":"cover"}],"evidence_notes":"John appears on chapter covers 1 time(s)","verified_on":"2026-04-26","verified_by":"extract_manga_facts.py v1"},{"id":"verified:John:epithet","subject":"John","predicate":"epithet","value":"Captain John","tier":"canon","intent":"serious","sources":[{"type":"sbs","volume":49,"qa_id":"0612","match_type":"verbatim+sentence","matched_form":"Captain John"},{"type":"wiki","page":"John","field":"epithet"}],"evidence_notes":"CANON (serious) — matched via 'verbatim+sentence' in SBS Vol 49 #612. Snippet: \"y in the World\", Chapter 233 of Volume 25, Buggy and his crew are searching for Captain John's treasure in a cave. And then in \"Perona's Wonder Garden\", Chapter…\"","verified_on":"2026-04-26","verified_by":"verify.py v3 (intent-aware)"}]