[{"id":"first_app:Asla","subject":"Asla","predicate":"first_appearance","value":{"chapter":1153,"type":"full"},"tier":"canon","sources":[{"type":"manga","chapter":1153,"appearance_type":"full"}],"evidence_notes":"Derived from appearances.csv — Asla first appears in Chapter 1153 (full)","verified_on":"2026-04-26","verified_by":"extract_manga_facts.py v1"},{"id":"total_app:Asla","subject":"Asla","predicate":"total_appearance_count","value":1,"tier":"canon","sources":[{"type":"manga","chapters":[1153],"summary":"1 distinct chapters"}],"evidence_notes":"Asla appears in 1 distinct chapters across the manga","verified_on":"2026-04-26","verified_by":"extract_manga_facts.py v1"}]