[{"id":"first_app:Thatch","subject":"Thatch","predicate":"first_appearance","value":{"chapter":440,"type":"flashback"},"tier":"canon","sources":[{"type":"manga","chapter":440,"appearance_type":"flashback"}],"evidence_notes":"Derived from appearances.csv — Thatch first appears in Chapter 440 (flashback)","verified_on":"2026-04-26","verified_by":"extract_manga_facts.py v1"},{"id":"total_app:Thatch","subject":"Thatch","predicate":"total_appearance_count","value":2,"tier":"canon","sources":[{"type":"manga","chapters":[440,552],"summary":"2 distinct chapters"}],"evidence_notes":"Thatch appears in 2 distinct chapters across the manga","verified_on":"2026-04-26","verified_by":"extract_manga_facts.py v1"},{"id":"flashback_count:Thatch","subject":"Thatch","predicate":"flashback_count","value":2,"tier":"canon","sources":[{"type":"manga","chapters":[440,552],"appearance_type":"flashback"}],"evidence_notes":"Thatch appears in flashback in 2 chapter(s)","verified_on":"2026-04-26","verified_by":"extract_manga_facts.py v1"}]