[{"id":"first_app:Kaneshiro","subject":"Kaneshiro","predicate":"first_appearance","value":{"chapter":72,"type":"full"},"tier":"canon","sources":[{"type":"manga","chapter":72,"appearance_type":"full"}],"evidence_notes":"Derived from appearances.csv — Kaneshiro first appears in Chapter 72 (full)","verified_on":"2026-04-26","verified_by":"extract_manga_facts.py v1"},{"id":"total_app:Kaneshiro","subject":"Kaneshiro","predicate":"total_appearance_count","value":3,"tier":"canon","sources":[{"type":"manga","chapters":[72,78,82],"summary":"3 distinct chapters"}],"evidence_notes":"Kaneshiro appears in 3 distinct chapters across the manga","verified_on":"2026-04-26","verified_by":"extract_manga_facts.py v1"}]