[{"id":"first_app:Sphinx","subject":"Sphinx","predicate":"first_appearance","value":{"chapter":529,"type":"full"},"tier":"canon","sources":[{"type":"manga","chapter":529,"appearance_type":"full"}],"evidence_notes":"Derived from appearances.csv — Sphinx first appears in Chapter 529 (full)","verified_on":"2026-04-26","verified_by":"extract_manga_facts.py v1"},{"id":"total_app:Sphinx","subject":"Sphinx","predicate":"total_appearance_count","value":3,"tier":"canon","sources":[{"type":"manga","chapters":[529,530,531],"summary":"3 distinct chapters"}],"evidence_notes":"Sphinx appears in 3 distinct chapters across the manga","verified_on":"2026-04-26","verified_by":"extract_manga_facts.py v1"}]