[{"id":"first_app:Goro","subject":"Goro","predicate":"first_appearance","value":{"chapter":316,"type":"cover"},"tier":"canon","sources":[{"type":"manga","chapter":316,"appearance_type":"cover"}],"evidence_notes":"Derived from appearances.csv — Goro first appears in Chapter 316 (cover)","verified_on":"2026-04-26","verified_by":"extract_manga_facts.py v1"},{"id":"total_app:Goro","subject":"Goro","predicate":"total_appearance_count","value":23,"tier":"canon","sources":[{"type":"manga","chapters":[316,318,319,320,321,322,323,324,325,326,329,330,331,332,333,335,336,337,338,339,340,344,348],"summary":"23 distinct chapters"}],"evidence_notes":"Goro appears in 23 distinct chapters across the manga","verified_on":"2026-04-26","verified_by":"extract_manga_facts.py v1"},{"id":"cover_count:Goro","subject":"Goro","predicate":"cover_appearance_count","value":23,"tier":"canon","sources":[{"type":"manga","chapters":[316,318,319,320,321,322,323,324,325,326,329,330,331,332,333,335,336,337,338,339,340,344,348],"appearance_type":"cover"}],"evidence_notes":"Goro appears on chapter covers 23 time(s)","verified_on":"2026-04-26","verified_by":"extract_manga_facts.py v1"}]