[{"id":"first_app:Nangi","subject":"Nangi","predicate":"first_appearance","value":{"chapter":954,"type":"silhouette"},"tier":"canon","sources":[{"type":"manga","chapter":954,"appearance_type":"silhouette"}],"evidence_notes":"Derived from appearances.csv — Nangi first appears in Chapter 954 (silhouette)","verified_on":"2026-04-26","verified_by":"extract_manga_facts.py v1"},{"id":"total_app:Nangi","subject":"Nangi","predicate":"total_appearance_count","value":4,"tier":"canon","sources":[{"type":"manga","chapters":[954,988,990,991],"summary":"4 distinct chapters"}],"evidence_notes":"Nangi appears in 4 distinct chapters across the manga","verified_on":"2026-04-26","verified_by":"extract_manga_facts.py v1"},{"id":"silhouette_count:Nangi","subject":"Nangi","predicate":"silhouette_appearance_count","value":1,"tier":"canon","sources":[{"type":"manga","chapters":[954],"appearance_type":"silhouette"}],"evidence_notes":"Nangi appears in silhouette 1 time(s)","verified_on":"2026-04-26","verified_by":"extract_manga_facts.py v1"}]