[{"id":"first_app:Vinsmoke_Judge","subject":"Vinsmoke Judge","predicate":"first_appearance","value":{"chapter":832,"type":"full"},"tier":"canon","sources":[{"type":"manga","chapter":832,"appearance_type":"full"}],"evidence_notes":"Derived from appearances.csv — Vinsmoke Judge first appears in Chapter 832 (full)","verified_on":"2026-04-26","verified_by":"extract_manga_facts.py v1"},{"id":"total_app:Vinsmoke_Judge","subject":"Vinsmoke Judge","predicate":"total_appearance_count","value":41,"tier":"canon","sources":[{"type":"manga","chapters":[832,833,834,838,839,840,841,842,843,844,845,847,849,852,853,856,859,860,861,862,864,865,868,869,870,871,872,899,900,902,1037,1067,1068,1070,1072,1073,1074,1077,1078,1113,1121],"summary":"41 distinct chapters"}],"evidence_notes":"Vinsmoke Judge appears in 41 distinct chapters across the manga","verified_on":"2026-04-26","verified_by":"extract_manga_facts.py v1"},{"id":"flashback_count:Vinsmoke_Judge","subject":"Vinsmoke Judge","predicate":"flashback_count","value":5,"tier":"canon","sources":[{"type":"manga","chapters":[840,841,852,853,1070],"appearance_type":"flashback"}],"evidence_notes":"Vinsmoke Judge appears in flashback in 5 chapter(s)","verified_on":"2026-04-26","verified_by":"extract_manga_facts.py v1"},{"id":"cover_count:Vinsmoke_Judge","subject":"Vinsmoke Judge","predicate":"cover_appearance_count","value":8,"tier":"canon","sources":[{"type":"manga","chapters":[1037,1067,1068,1072,1073,1074,1077,1078],"appearance_type":"cover"}],"evidence_notes":"Vinsmoke Judge appears on chapter covers 8 time(s)","verified_on":"2026-04-26","verified_by":"extract_manga_facts.py v1"},{"id":"verified:Vinsmoke_Judge:birthday","subject":"Vinsmoke Judge","predicate":"birthday","value":"May 12th","tier":"likely","intent":"ambiguous","sources":[{"type":"sbs","volume":87,"qa_id":"1178","match_type":"digit-proximity","matched_form":"digit-group"},{"type":"wiki","page":"Vinsmoke_Judge","field":"birthday"}],"evidence_notes":"LIKELY (ambiguous) — matched via 'digit-proximity' in SBS Vol 87 #1178. Snippet: \"ed from V (Vinsmoke Family), 2-8 can be derived from Meow **Vinsmoke Judge: May 12; 5 is derived from V, J is the 10th letter of the English alphabet (Vinsmoke …\"","verified_on":"2026-04-26","verified_by":"verify.py v3 (intent-aware)"},{"id":"verified:Vinsmoke_Judge:blood_type","subject":"Vinsmoke Judge","predicate":"blood_type","value":"S","tier":"canon","intent":"serious","sources":[{"type":"sbs","volume":87,"qa_id":"1168","match_type":"verbatim+sentence","matched_form":"S"},{"type":"wiki","page":"Vinsmoke_Judge","field":"blood_type"}],"evidence_notes":"CANON (serious) — matched via 'verbatim+sentence' in SBS Vol 87 #1168. Snippet: \"Oda-san, hello!! Vinsmoke Judge and Sanji's hair are yellow. If this is so, did the remaining four children in the Vinsmoke…\"","verified_on":"2026-04-26","verified_by":"verify.py v3 (intent-aware)"}]