[{"id":"first_app:Doma","subject":"Doma","predicate":"first_appearance","value":{"chapter":551,"type":"full"},"tier":"canon","sources":[{"type":"manga","chapter":551,"appearance_type":"full"}],"evidence_notes":"Derived from appearances.csv — Doma first appears in Chapter 551 (full)","verified_on":"2026-04-26","verified_by":"extract_manga_facts.py v1"},{"id":"total_app:Doma","subject":"Doma","predicate":"total_appearance_count","value":6,"tier":"canon","sources":[{"type":"manga","chapters":[551,563,567,570,576,579],"summary":"6 distinct chapters"}],"evidence_notes":"Doma appears in 6 distinct chapters across the manga","verified_on":"2026-04-26","verified_by":"extract_manga_facts.py v1"}]