[{"id":"first_app:Mayushika","subject":"Mayushika","predicate":"first_appearance","value":{"chapter":269,"type":"full"},"tier":"canon","sources":[{"type":"manga","chapter":269,"appearance_type":"full"}],"evidence_notes":"Derived from appearances.csv — Mayushika first appears in Chapter 269 (full)","verified_on":"2026-04-26","verified_by":"extract_manga_facts.py v1"},{"id":"total_app:Mayushika","subject":"Mayushika","predicate":"total_appearance_count","value":3,"tier":"canon","sources":[{"type":"manga","chapters":[269,270,271],"summary":"3 distinct chapters"}],"evidence_notes":"Mayushika appears in 3 distinct chapters across the manga","verified_on":"2026-04-26","verified_by":"extract_manga_facts.py v1"}]